<?xml version="1.0" encoding="UTF-8"?>
<!DOCTYPE CFGS SYSTEM "Alumnado.dtd">

<CFGS>
    <alumno>
        <NIF></NIF>
        <resultado resultado="apto"></resultado>
        <observaciones></observaciones>
        <MAC></MAC>
    </alumno>
    <alumno>
        <NIF></NIF>
        <resultado resultado="noApto"></resultado>
        <IP></IP>
    </alumno>
</CFGS>
